{"$schema":"http://json-schema.org/draft-07/schema#","additionalProperties":false,"description":"One verified vendor/tool record. Every factual claim must trace to a source in `sources`. Unverifiable facts use the literal string \"unverified\", never a guess. Retention claims obey specs/RETENTION-RULE.md: ranges only, statute + section + as-of date, Law 25 never cited as the source of a numerical period.","properties":{"categories":{"items":{"enum":["data_mapping","privacy_management","consent","dsr_automation","data_discovery","dspm","grc","records_retention","open_source"],"type":"string"},"minItems":1,"type":"array","uniqueItems":true},"data_residency":{"description":"Hosting regions / residency options, or the literal \"unverified\".","minLength":1,"type":"string"},"description":{"maxLength":2000,"minLength":20,"type":"string"},"headquarters":{"description":"City, Country or the literal \"unverified\".","minLength":1,"type":"string"},"id":{"description":"URL-safe slug, e.g. \"onetrust\".","pattern":"^[a-z0-9]+(-[a-z0-9]+)*$","type":"string"},"law25_relevance":{"description":"Why this tool matters for Quebec Law 25 work. Must never present Law 25 as the source of a numerical retention period (enforced by the validator).","minLength":10,"type":"string"},"mapping_features":{"description":"Data-mapping-relevant capabilities, each verifiable from a listed source.","items":{"minLength":5,"type":"string"},"minItems":1,"type":"array"},"name":{"maxLength":120,"minLength":1,"type":"string"},"pricing_model":{"description":"e.g. \"paid; tiers unverified\", \"free tier + paid plans\", \"open source (self-hosted)\". No invented prices; any stated figure needs a source note mentioning pricing.","minLength":1,"type":"string"},"retention_features":{"additionalProperties":false,"properties":{"claims":{"items":{"additionalProperties":false,"properties":{"as_of":{"pattern":"^[0-9]{4}-[0-9]{2}-[0-9]{2}$","type":"string"},"range":{"description":"Range only, e.g. \"6 to 7 years\" or \"6 to 7 years after the last business transaction\".","pattern":"^[0-9]+ to [0-9]+ years( .*)?$","type":"string"},"section":{"minLength":1,"type":"string"},"statute":{"minLength":3,"type":"string"}},"required":["range","statute","section","as_of"],"type":"object"},"type":"array"},"notes":{"minLength":1,"type":"string"},"verify":{"description":"True when no retention period could be cited to a statute; then claims must be empty and notes must say what to verify.","type":"boolean"}},"required":["notes","claims","verify"],"type":"object"},"sources":{"items":{"additionalProperties":false,"properties":{"consulted":{"pattern":"^[0-9]{4}-[0-9]{2}-[0-9]{2}$","type":"string"},"note":{"type":"string"},"url":{"format":"uri","pattern":"^https://","type":"string"}},"required":["url","consulted"],"type":"object"},"minItems":1,"type":"array"},"verification":{"additionalProperties":false,"properties":{"checked_utc":{"pattern":"^[0-9]{4}-[0-9]{2}-[0-9]{2}T[0-9]{2}:[0-9]{2}:[0-9]{2}Z$","type":"string"},"status":{"enum":["verified","partial"],"type":"string"}},"required":["status","checked_utc"],"type":"object"},"website":{"format":"uri","pattern":"^https://","type":"string"}},"required":["id","name","categories","description","website","headquarters","data_residency","mapping_features","retention_features","law25_relevance","pricing_model","sources","verification"],"title":"AI-data-map vendor KB entry","type":"object"}