[
 {
  "categories": [
   "consent",
   "data_mapping"
  ],
  "data_residency": "unverified",
  "description": "AppLovin Corporation (Nasdaq: APP) provides AI-powered advertising solutions for mobile app developers and advertisers. Its principal executive offices are at 1100 Page Mill Road, Palo Alto, California, per its SEC filings. Its Axon advertising platform operates across mobile applications worldwide, reaching over one billion daily active users, and the company also operates a portfolio of its own mobile apps.",
  "headquarters": "Palo Alto, USA",
  "id": "applovin",
  "law25_relevance": "Quebec businesses embedding the AppLovin SDK or buying its ads route Quebec users' device and advertising identifiers to an adtech intermediary, so the SDK, its publishers, and advertising partners must appear in the organization's data map as recipients, with the consent flow documented.",
  "mapping_features": [
   "Its published US multistate privacy notice contains a table of personal information categories collected: identifiers such as IP address and advertising IDs (IDFA/GAID/Amazon FOSAID), email and phone identifiers, account records, and financial information, with sources (devices, publishers, advertising partners) and disclosure recipients (service providers, advertising partners, government and law enforcement).",
   "Its MAX SDK support documentation describes a GDPR consent flow, including detecting whether a user is in a GDPR region and re-showing the consent-management-platform prompt to existing users to reset consent."
  ],
  "name": "AppLovin Corporation",
  "pricing_model": "platform fees paid by advertisers; exact tiers unverified",
  "retention_features": {
   "claims": [],
   "notes": "No vendor-published statutory retention schedule found in the listed sources; retention is governed by contract and the company's published privacy documentation.",
   "verify": true
  },
  "sources": [
   {
    "consulted": "2026-10-05",
    "note": "US multistate privacy notice: personal information categories, sources, and disclosure recipients",
    "url": "https://legal.applovin.com/multistate-privacy-notice/"
   },
   {
    "consulted": "2026-10-05",
    "note": "MAX SDK docs: GDPR consent flow and CMP re-prompt for existing users",
    "url": "https://support.axon.ai/en/max/ios/overview/terms-and-privacy-policy-flow"
   },
   {
    "consulted": "2026-10-05",
    "note": "AppLovin 10-Q for quarter ended June 30, 2025: principal executive offices and business description",
    "url": "https://files.quartr.com/reports/0fbc2-2025-08-06-09-24-14.pdf?ref=dGlwcmFua3M="
   }
  ],
  "verification": {
   "checked_utc": "2026-10-05T03:43:27Z",
   "status": "verified"
  },
  "website": "https://www.applovin.com/"
 },
 {
  "categories": [
   "data_mapping"
  ],
  "data_residency": "unverified",
  "description": "Arm Holdings plc (Nasdaq: ARM) is a British semiconductor and software design company headquartered in Cambridge, England, majority owned by SoftBank Group. It licenses processor designs (Cortex, Neoverse) and related intellectual property to chipmakers rather than manufacturing chips itself.",
  "headquarters": "Cambridge, United Kingdom",
  "id": "arm",
  "law25_relevance": "Arm appears in Quebec data maps mainly as a vendor of licensed software and as the operator of its website and support channels, which collect professional contact and device information from Quebec licensees and visitors.",
  "mapping_features": [
   "Its privacy policy lists personal data collected directly (name, job title, company name, address, phone number, email address, credentials) and obtained from third-party providers of business contact information (professional contact details, job titles, IP addresses), used for targeted advertising and profiling.",
   "Its Fixed Virtual Platforms end user license agreement discloses that Arm software may transmit computer information (IP address, hardware and operating system details, tool serial numbers) to Arm to verify license rights and monitor compliance."
  ],
  "name": "Arm Holdings plc",
  "pricing_model": "IP licensing and royalty model; pricing unverified",
  "retention_features": {
   "claims": [],
   "notes": "No vendor-published statutory retention schedule found in the listed sources; retention is governed by contract and the company's published privacy documentation.",
   "verify": true
  },
  "sources": [
   {
    "consulted": "2026-10-05",
    "note": "Arm privacy policy: personal data collected directly and from third-party business-contact providers",
    "url": "https://www.arm.com/company/policies/privacy"
   },
   {
    "consulted": "2026-10-05",
    "note": "Arm Fixed Virtual Platforms EULA: software transmits computer information to Arm for license verification",
    "url": "https://documentation-service.arm.com/static/659816b8b52744113be62872?token="
   },
   {
    "consulted": "2026-10-05",
    "note": "Arm Holdings: HQ Cambridge, licensing business, SoftBank ownership",
    "url": "https://en.wikipedia.org/wiki/Arm_Holdings"
   }
  ],
  "verification": {
   "checked_utc": "2026-10-05T03:43:27Z",
   "status": "verified"
  },
  "website": "https://www.arm.com/"
 },
 {
  "categories": [
   "data_mapping"
  ],
  "data_residency": "unverified",
  "description": "ASML Holding N.V. is a Dutch multinational headquartered in Veldhoven, Netherlands, that develops and manufactures photolithography machines used to produce integrated circuits. It is the sole producer of extreme ultraviolet (EUV) lithography systems, required for the most advanced chips, and is Europe's largest technology company by market capitalization.",
  "headquarters": "Veldhoven, Netherlands",
  "id": "asml",
  "law25_relevance": "ASML is a business-to-business equipment vendor whose relevant personal data in a Quebec data map is limited to business-partner and recruitment data; its Binding Corporate Rules and impact-assessment program are the relevant transfer safeguards to record.",
  "mapping_features": [
   "Its annual filings describe a global privacy program whose Privacy Controls framework includes privacy impact assessments and data protection impact assessments, with privacy notices for business partners and recruitment explaining why personal data is collected and how ASML uses it.",
   "The Dutch Data Protection Authority approved ASML's Controller Binding Corporate Rules as appropriate safeguards for intra-group personal data transfers under the GDPR."
  ],
  "name": "ASML Holding N.V.",
  "pricing_model": "equipment sales and service contracts; pricing unverified",
  "retention_features": {
   "claims": [],
   "notes": "No vendor-published statutory retention schedule found in the listed sources; retention is governed by contract and the company's published privacy documentation.",
   "verify": true
  },
  "sources": [
   {
    "consulted": "2026-10-05",
    "note": "ASML annual filing: global privacy program, Privacy Controls framework, PIAs and DPIAs",
    "url": "https://www.sec.gov/Archives/edgar/data/937966/000093796622000013/asml-20211231.htm"
   },
   {
    "consulted": "2026-10-05",
    "note": "Dutch DPA decision approving ASML's Controller Binding Corporate Rules",
    "url": "https://edpb-europa-eu.ezproxy.utas.edu.au/system/files/2025-09/asml-national-decision_en_0.pdf"
   },
   {
    "consulted": "2026-10-05",
    "note": "ASML: HQ Veldhoven, photolithography business, EUV systems",
    "url": "https://en.wikipedia.org/w/?title=ASML&printable=yes"
   }
  ],
  "verification": {
   "checked_utc": "2026-10-05T03:43:27Z",
   "status": "verified"
  },
  "website": "https://www.asml.com/en"
 },
 {
  "categories": [
   "data_mapping"
  ],
  "data_residency": "unverified",
  "description": "Astera Labs, Inc. (Nasdaq: ALAB), founded in 2017 and headquartered in Santa Clara, California, develops semiconductor-based connectivity solutions for cloud computing and AI infrastructure. Its Intelligent Connectivity Platform includes PCIe retimers and CXL memory connectivity products, sold to hyperscalers and enterprises.",
  "headquarters": "Santa Clara, USA",
  "id": "astera-labs",
  "law25_relevance": "Astera Labs is a component supplier whose privacy footprint is its corporate site and customer support channels; its disclosure that site data may be transferred to US servers is the relevant cross-border transfer to record in a Quebec data map.",
  "mapping_features": [
   "Its privacy policy states that personal data provided via its site may be transferred to Astera Labs offices and servers and authorized third parties in the United States.",
   "Its privacy policy describes passive collection of non-identifiable site-usage information and the use of cookies, stating that cookies are not used to collect personal data without the visitor's permission."
  ],
  "name": "Astera Labs, Inc.",
  "pricing_model": "semiconductor product sales; pricing unverified",
  "retention_features": {
   "claims": [],
   "notes": "No vendor-published statutory retention schedule found in the listed sources; retention is governed by contract and the company's published privacy documentation.",
   "verify": true
  },
  "sources": [
   {
    "consulted": "2026-10-05",
    "note": "Astera Labs privacy policy: US transfers, cookies, non-identifiable data",
    "url": "https://asteralabs.com/privacy-policy/"
   },
   {
    "consulted": "2026-10-05",
    "note": "Astera Labs profile: Santa Clara HQ, business description, founding year",
    "url": "https://stoculator.com/stock/ALAB/profile"
   }
  ],
  "verification": {
   "checked_utc": "2026-10-05T03:43:27Z",
   "status": "verified"
  },
  "website": "https://www.asteralabs.com/"
 },
 {
  "categories": [
   "data_mapping"
  ],
  "data_residency": "unverified",